순서,출원번호,출원일자,공개번호,공개일자,공고번호,공고일자,등록번호,등록일자,발명의명칭,IPC분류,출원인,요약
1,16985460,2020.08.05,20220044033,2022.02.10,20220044033,2022.02.10,,,MULTIPLE RESOLUTION DEEP NEURAL NETWORKS FOR VEHICLE AUTONOMOUS DRIVING SYSTEMS,"G06K9/00,G06K9/62,G06N3/08,G06N3/04,G06N20/20,G06T7/00,G06T7/20,G01S17/89","Dalong Li,Stephen Horton,Neil R Garbacik","Techniques for training multiple resolution deep neural networks (DNNs) for vehicle autonomous driving comprise obtaining a training dataset for training a plurality of DNNs for an autonomous driving feature of the vehicle, sub-sampling the training dataset to obtain a plurality of training datasets comprising the training dataset and one or more sub-sampled datasets each having a different resolution than a remainder of the plurality of training datasets, training the plurality of DNNs using the plurality of training datasets, respectively, determining a plurality of outputs for the autonomous driving feature using the plurality of trained DNNs and the input data, receiving input data for the autonomous driving feature captured by a sensor device, and determining a best output for the autonomous driving feature using the plurality of outputs."
2,17229264,2021.04.13,,,11254331,2022.02.22,11254331,2022.02.22,"Learning method and learning device for updating object detector, based on deep learning, of autonomous vehicle to adapt the object detector to driving circumstance, and updating method and updating device using the same","B60W60/00,G06K9/62,G06K9/32,G06N3/08","Stradvision, Inc.","A method for updating an object detector of an autonomous vehicle to adapt the object detector to a driving circumstance is provided. The method includes steps of: a learning device (a) (i) inputting a training image, corresponding to a driving circumstance, into a circumstance-specific object detector to apply (i-1) convolution to the training image to generate a circumstance-specific feature map, (i-2) ROI pooling to the circumstance-specific feature map to generate a circumstance-specific pooled feature map, and (i-3) fully-connected operation to the circumstance-specific pooled feature map to generate circumstance-specific object detection information and (ii) inputting the circumstance-specific feature map into a circumstance-specific ranking network to (ii-1) apply deconvolution to the circumstance-specific feature map and generate a circumstance-specific segmentation map and (ii-2) generate a circumstance-specific rank score via a circumstance-specific discriminator; and (b) training the circumstance-specific object detector, the circumstance-specific deconvolutional layer, the circumstance-specific convolutional layer, and the circumstance-specific discriminator."
3,17229264,2021.04.13,20210354721,2021.11.18,20210354721,2021.11.18,,,"Learning Method and Learning Device for Updating Object Detector, Based on Deep Learning, of Autonomous Vehicle to Adapt the Object Detector to Driving Circumstance, and Updating Method and Updating Device Using the Same","B60W60/00,G06K9/62,G06N3/08,G06K9/32","Stradvision, Inc.","A method for updating an object detector of an autonomous vehicle to adapt the object defector to a driving circumstance is provided. The method includes steps of; a learning device (a) (i) inputting a training image, corresponding to a driving circumstance, into a circumstance-specific object detector to apply (i-1) convolution to the training image to generate a circumstance-specific feature map, (i-2) ROI pooling to the circumstance-specific feature map to generate a circumstance-specific pooled feature map, and (i-3) fully-connected operation to the circumstance-specific pooled feature map to generate circumstance-specific object detection information and (ii) inputting the circumstance-specific feature map into a circumstance-specific ranking network to (ii-1) apply deconvolution to the circumstance-specific feature map and generate a circumstance-specific segmentation map and (ii-2) generate a circumstance-specific rank score via a circumstance-specific discriminator; and (b) training the circumstance-specific object detector, the circumstance-specific deconvolutional layer, the circumstance-specific convolutional layer, and the circumstance-specific discriminator."
4,17073860,2020.10.19,20220119002,2022.04.21,20220119002,2022.04.21,,,System and Method for Neural Network-Based Autonomous Driving,"B60W60/00,B60W40/11,B60W40/112,B60W40/114,B60W50/04,G06N3/04,G06N3/08","Marvell Asia Pte, Ltd.","A system and corresponding method for autonomous driving of a vehicle are provided. The system comprises at least one neural network (NN) that generates at least one output for controlling the autonomous driving. The system further comprises a main data path that routes bulk sensor data to the at least one NN and a low-latency data path with reduced latency relative to the main data path. The low-latency data path routes limited sensor data to the at least one NN which, in turn, employs the limited sensor data to improve performance of the at least one NN's processing of the bulk sensor data for generating the at least one output. Improving performance of the at least one NN's processing of the bulk sensor data enables the system to, for example, identify a safety hazard sooner, enabling the autonomous driving to divert the vehicle and avoid contact with the safety hazard."
5,16519814,2019.07.23,,,11199839,2021.12.14,11199839,2021.12.14,Method of real time vehicle recognition with neuromorphic computing network for autonomous driving,"G05D1/00,G05B13/00,G08G1/16,G06K5/00,G06K7/00,G06N20/00,G05D1/02,G05B13/02","HRL Laboratories, LLC","Described is a system for online vehicle recognition in an autonomous driving environment. Using a learning network comprising an unsupervised learning component and a supervised learning component, images of moving vehicles extracted from videos captured in the autonomous driving environment are learned and classified. Vehicle feature data is extracted from input moving vehicle images. The extracted vehicle feature data is clustered into different vehicle classes using the unsupervised learning component. Vehicle class labels for the different vehicle classes are generated using the supervised learning component. Based on a vehicle class label for a moving vehicle in the autonomous driving environment, the system selects an action to be performed by the autonomous vehicle, and causes the selected action to be performed by the autonomous vehicle in the autonomous driving environment."
6,17024137,2020.09.17,20210001880,2021.01.07,20210001880,2021.01.07,,,"VEHICLE-MOUNTED CONTROL UNIT, AND METHOD AND APPARATUS FOR FPGA BASED AUTOMATIC DRIVING OF VEHICLE","B60W60/00,H04N7/18,G06K9/00,G06N3/08,G05D1/02,G05D1/00,G01S13/86","BAIDU ONLINE NETWORK TECHNOLOGY (BEIJING) CO., LTD.,BAIDU ONLINE NETWORK TECHNOLOGY (BEIJING) CO., LTD.","Embodiments of the present disclosure provide a vehicle-mounted control unit, and a method and an apparatus for FPGA based automatic driving of a vehicle, which includes a MCU and a first SoC implemented by being integrated with an ARM through the FPGA, where the vehicle-mounted control unit is set on an automatic driving vehicle, the FPGA of the first SoC receives video data sent by a vehicle-mounted camera, performs visual perception on the video data by using a first neural network algorithm to obtain first perception information; and sends the first perception information to the ARM of the first SoC. The ARM of the first SoC processes the first perception information to obtain first decision information, and sends the first decision information to the MCU. Finally, the MCU generates a control command according to the first decision information and sends it to the corresponding execution mechanism."
7,16519814,2019.07.23,20200026287,2020.01.23,20200026287,2020.01.23,,,METHOD OF REAL TIME VEHICLE RECOGNITION WITH NEUROMORPHIC COMPUTING NETWORK FOR AUTONOMOUS DRIVING,"G05D1/00,G05B13/02,G05D1/02","HRL Laboratories, LLC","Described is a system for online vehicle recognition in an autonomous driving environment. Using a learning network comprising an unsupervised learning component and a supervised learning component, images of moving vehicles extracted from videos captured in the autonomous driving environment are learned and classified. Vehicle feature data is extracted from input moving vehicle images. The extracted vehicle feature data is clustered into different vehicle classes using the unsupervised learning component. Vehicle class labels for the different vehicle classes are generated using the supervised learning component. Based on a vehicle class label for a moving vehicle in the autonomous driving environment, the system selects an action to be performed by the autonomous vehicle, and causes the selected action to be performed by the autonomous vehicle in the autonomous driving environment."
8,16709790,2019.12.10,20200180647,2020.06.11,20200180647,2020.06.11,,,NEURAL NETWORK BASED MODELING AND SIMULATION OF NON-STATIONARY TRAFFIC OBJECTS FOR TESTING AND DEVELOPMENT OF AUTONOMOUS VEHICLE SYSTEMS,"B60W50/00,G05D1/00,B60W40/04","Perceptive Automata, Inc.","A system performs modeling and simulation of non-stationary traffic entities for testing and development of modules used in an autonomous vehicle system. The system uses a machine learning based model that predicts hidden context attributes for traffic entities that may be encountered by a vehicle in traffic. The system generates simulation data for testing and development of modules that help navigate autonomous vehicles. The generated simulation data may be image or video data including representations of traffic entities, for example, pedestrians, bicyclists, and other vehicles. The system may generate simulation data using generative adversarial neural networks."
9,17396269,2021.08.06,20220041180,2022.02.10,20220041180,2022.02.10,,,SYSTEM AND METHOD FOR GENERATING AND CONTROLLING DRIVING PATHS IN AUTONOMOUS VEHICLE,"B60W60/00,B60W40/105,B60W10/20,G06N3/04,G06N3/08","Electronics and Telecommunications Research Institute,Electronics and Telecommunications Research Institute","Provided is a method of generating and controlling a driving path for an autonomous vehicle, the method including generating a driving path that matches a driving intention on the basis of sensing data acquired from a sensing module of the autonomous vehicle, determining steering angle information corresponding to the generated driving path, and controlling a steering angle of the autonomous vehicle."
10,16724833,2019.12.23,20200239029,2020.07.30,10919543,2021.02.16,10919543,2021.02.16,Learning method and learning device for determining whether to switch mode of vehicle from manual driving mode to autonomous driving mode by performing trajectory-based behavior analysis on recent driving route,"B60W60/00,H04W4/40,B60W30/095,G06K9/00,G06K9/62,G06N3/04,G06N3/08","StradVision, Inc.","A learning method for calculating collision probability, to be used for determining whether it is appropriate or not to switch driving modes of a vehicle capable of an autonomous driving, by analyzing a recent driving route of a driver is provided. And the method includes steps of: (a) a learning device, on condition that a status vector and a trajectory vector are acquired, performing processes of (i) instructing a status network to generate a status feature map and (ii) instructing a trajectory network to generate a trajectory feature map; (b) the learning device instructing a safety network to calculate a predicted collision probability representing a predicted probability of an accident occurrence; and (c) the learning device instructing a loss layer to generate a loss by referring to the predicted collision probability and a GT collision probability, which have been acquired beforehand, to learn at least part of parameters."
11,16725064,2019.12.23,20200242411,2020.07.30,20200242411,2020.07.30,,,"LEARNING METHOD AND LEARNING DEVICE FOR SWITCHING MODES OF AUTONOMOUS VEHICLE BASED ON ON-DEVICE STANDALONE PREDICTION TO THEREBY ACHIEVE SAFETY OF AUTONOMOUS DRIVING, AND TESTING METHOD AND TESTING DEVICE USING THE SAME","G06K9/62,G06K9/00,G06N3/04,G06N3/08,G05D1/00","StradVision, Inc.","A learning method for generating parameters capable of representing a degree of credibility of an object detection during a process of the object detection is provided. And the method includes steps of: (a) a learning device instructing a convolutional layer to generate a convolutional feature map by applying a convolutional operation to a training image; (b) the learning device instructing an anchor layer to generate an RPN confidence map including RPN confidence scores; (c) the learning device instructing an FC layer to generate CNN confidence scores, to thereby generate a CNN confidence map; and (d) the learning device instructing a loss layer to learn parameters in the CNN and the RPN by performing backpropagation using an RPN loss and a CNN loss, generated by referring to the RPN confidence map, the CNN confidence map, an estimated object detection result and a GT object detection result."
12,16725064,2019.12.23,,,10726303,2020.07.28,10726303,2020.07.28,"Learning method and learning device for switching modes of autonomous vehicle based on on-device standalone prediction to thereby achieve safety of autonomous driving, and testing method and testing device using the same","G06K9/62,G06K9/00,G06N3/08,G05D1/00,G06N3/04","StradVision, Inc.","A learning method for generating parameters capable of representing a degree of credibility of an object detection during a process of the object detection is provided. And the method includes steps of: (a) a learning device instructing a convolutional layer to generate a convolutional feature map by applying a convolutional operation to a training image; (b) the learning device instructing an anchor layer to generate an RPN confidence map including RPN confidence scores; (c) the learning device instructing an FC layer to generate CNN confidence scores, to thereby generate a CNN confidence map; and (d) the learning device instructing a loss layer to learn parameters in the CNN and the RPN by performing backpropagation using an RPN loss and a CNN loss, generated by referring to the RPN confidence map, the CNN confidence map, an estimated object detection result and a GT object detection result."
13,16936897,2020.07.23,20200357285,2020.11.12,20200357285,2020.11.12,,,APPARATUS AND METHOD FOR PREVENTING INCORRECT BOARDING OF AUTONOMOUS DRIVING VEHICLE,"G08G1/00,H04W4/46,G08B25/01",LG ELECTRONICS INC.,"A method and an apparatus for preventing an incorrect boarding of an autonomous driving vehicle are disclosed. The method includes calling a first vehicle, acquiring positional information of the first vehicle and positional information of a passenger terminal, determining that a passenger boards a second vehicle when a position of the passenger terminal is continuously changed and a position of the first vehicle and the position of the passenger terminal are farther than a preset distance after a time point when the first vehicle is called, displaying a message inquiring whether to transfer to the first vehicle on a display of the passenger terminal, and transmitting a response to the message to a server."
14,16494724,2019.04.26,,,11367169,2022.06.21,11367169,2022.06.21,Method for processing picture of automatic driving vehicle,"G06T5/50,G06T7/70,B60W60/00,B60W50/00,B60W50/02,G06T7/20,G06N3/04",LG ELECTRONICS INC.,"Disclosed herein is a method for processing a picture of an automatic driving vehicle. The method for processing a picture of an automatic driving vehicle according to an embodiment of the present disclosure includes obtaining a first image from a camera while a vehicle on which the camera is driving, generating a prediction signal for predicting a sign of occurrence of White-Out from the first image, when a quantity of light which is a threshold brightness or higher from the first image, storing the first image during a first period when the prediction signal is generated, and predicting and correcting a second image based on the first image stored during the first period and a correction model, when the second image in which the White-Out occurs in the first image is detected on a specific time during the first period, and the correction model is a result of learning the second image by processing high dynamic range (HDR) image. At least one of the automatic driving vehicle according to the present disclosure, a user terminal and a server may be linked with artificial intelligence, robot, Augmented Reality (AR), virtual reality (VR), and the like."
15,16494724,2019.04.26,20210366088,2021.11.25,20210366088,2021.11.25,,,METHOD FOR PROCESSING PICTURE OF AUTOMATIC DRIVING VEHICLE,"G06T5/50,G06T7/20,G06T7/70,B60W60/00,B60W50/00,B60W50/02","LG ELECTRONICS INC.,LG ELECTRONICS INC.","Disclosed herein is a method for processing a picture of an automatic driving vehicle. The method for processing a picture of an automatic driving vehicle according to an embodiment of the present disclosure includes obtaining a first image from a camera while a vehicle on which the camera is driving, generating a prediction signal for predicting a sign of occurrence of White-Out from the first image, when a quantity of light which is a threshold brightness or higher from the first image, storing the first image during a first period when the prediction signal is generated, and predicting and correcting a second image based on the first image stored during the first period and a correction model, when the second image in which the White-Out occurs in the first image is detected on a specific time during the first period, and the correction model is a result of learning the second image by processing high dynamic range (HDR) image. At least one of the automatic driving vehicle according to the present disclosure, a user terminal and a server may be linked with artificial intelligence, robot, Augmented Reality (AR), virtual reality (VR), and the like."
16,16548747,2019.08.22,20190377360,2019.12.12,20190377360,2019.12.12,,,METHOD FOR ITEM DELIVERY USING AUTONOMOUS DRIVING VEHICLE,"G05D1/02,G08G1/127,H04W4/44,G06Q10/08","LG ELECTRONICS INC.,LG ELECTRONICS INC.","There is provided a method of delivering an item using an autonomous driving vehicle, including: receiving, from a server, a driving request signal for an item delivery service and controlling a vehicle to reach a location of a first terminal; providing a user of the first terminal with an item storage space, in a case where an authentication completion signal for the user of the first terminal is received from the server after the vehicle reaches the location of the first terminal; controlling the vehicle to reach the location of the second terminal, in a case where storage of the item is completed; and providing a user of the second terminal with the item, in a case where an authentication completion signal for the user of the second terminal is received from the server after the vehicle reaches the location of the second terminal."
17,17516129,2021.11.01,20220341739,2022.10.27,20220341739,2022.10.27,,,APPARATUS FOR GENERATING ROUTE OF AUTONOMOUS DRIVING VEHICLE AND METHOD FOR OFFERING SERVICE BY AUTONOMOUS DRIVING VEHICLE,"G01C21/34,G06Q10/04,G05D1/02,G06Q50/30,G06N3/02","HYUNDAI MOTOR COMPANY,Kia Corporation,HYUNDAI MOTOR COMPANY,Kia Corporation","An apparatus of generating a route of an autonomous driving vehicle may include an information obtaining device to obtain information on a road and information on a demand amount of the autonomous driving vehicle, and a controller to generate a map based on the information obtained from the information obtaining device and to generate a docking point based on the map."
18,17201412,2021.03.15,20210284193,2021.09.16,20210284193,2021.09.16,,,METHOD AND SYSTEM FOR AUTONOMOUS DRIVING OF A VEHICLE,"B60W60/00,G06K9/00,G06N3/08,G06K9/62",KOPERNIKUS AUTOMOTIVE GMBH,"The disclosure relates to a method for remote-controlled autonomous driving of a vehicle (  201  ) having the following method steps:  capturing the vehicle (  201  ) with the aid of at least one sensor, in particular camera, arranged in the surroundings of the vehicle (  201  ), determining a movement path for the vehicle (  201  ) by means of a processing device (  501  ) located outside the vehicle,  transmitting the movement path and/or control commands regarding the movement path to the vehicle (  201  ), and  implementing the movement path and/or the control commands in the vehicle (  201  ), in order to move the vehicle (  201  ) in accordance with the movement path."
19,16800125,2020.02.25,20210263157,2021.08.26,20210263157,2021.08.26,,,AUTOMATED LABELING SYSTEM FOR AUTONOMOUS DRIVING VEHICLE LIDAR DATA,"G01S17/89,G01S17/931,G01S17/86,G01S13/86,G06K9/00",Baidu USA LLC,A system and method for using high-end perception sensors such as high-end LIDARs to automatically label sensor data of low-end LIDARs of autonomous driving vehicles is disclosed. A perception system operating with a high-end LIDAR may process sensed data from the high-end LIDAR to detect objects and generate metadata of objects surrounding the vehicle. The confidence level of correctly identifying the objects using the high-end LIDAR may be further enhanced by fusing the data from the high-end LIDAR with data from other sensors such as cameras and radars. The method may use the detected objects and metadata of the detected objects processed from the data captured by the high-end LIDAR and other sensors as ground truth to label data of a same scene captured by a low-end LIDAR mounted on the vehicle. A neural network may use the labeled sensor data from the low-end LIDAR during offline supervised training.
20,16248214,2019.01.15,20200225676,2020.07.16,10915109,2021.02.09,10915109,2021.02.09,Control of autonomous vehicle based on pre-learned passenger and environment aware driving style profile,"G05D1/02,B60W40/09,G06N20/00,B60W50/00,G05D1/00",GM Global Technology Operations LLC,"A method for controlling a vehicle includes collecting data about human driving styles; machine learning how the human driver reacts to different traffic scenarios based on the collected data to create a plurality of human driving styles profiles; selecting an optimal driving profile of the plurality of human driving styles profiles, wherein the optimal driving profile is selected based feedback provided by a passenger of the vehicle, the feedback is indicative of a pleasantness of each of the plurality of human driving styles profiles; creating a driving plan based on the optimal driving profile; commanding the vehicle to execute the driving plan in a controlled environment to test the pleasantness of the optimal driving profile; and receiving a pleasantness rating from the passenger of the vehicle while the vehicle executes the driving plan."
21,17065910,2020.10.08,20210024346,2021.01.28,20210024346,2021.01.28,,,"METHOD, DEVICE AND SYSTEM FOR AUTOMATIC OILING OF LONG-DISTANCE TRANSPORT VEHICLE","B67D7/30,G01C21/34,G07C5/00,G05D1/00,G08G1/0968,B67D7/04,G08G1/0967,G08G1/00","Beijing Tusen Weilai Technology Co., Ltd.","The present application discloses a method, device and system for automatic oiling of a long-distance transport vehicle. The method provided by the present application includes: obtaining, by a transport planning system at a network side, vehicle status information, transport mission information and highway port information of the vehicle before the long-distance transport vehicle starts from a highway port of departure; generating a transport plan according to the vehicle status information, the transport mission information and the highway port information, wherein the transport plan comprises at least one highway port to be stopped at, cargo quantity to be loaded at each highway port to be stopped at and oil mass to be filled at each highway port to be stopped at; and sending the transport plan to the vehicle"
22,16783845,2020.02.06,,,11467579,2022.10.11,11467579,2022.10.11,Probabilistic neural network for predicting hidden context of traffic entities for autonomous vehicles,"G05D1/00,G06N7/00,G06N3/08,G05D1/02,B60W60/00","Perceptive Automata, Inc.",An autonomous vehicle uses probabilistic neural networks to predict hidden context attributes associated with traffic entities. The hidden context represents behavior of the traffic entities in the traffic. The probabilistic neural network is configured to receive an image of traffic as input and generate output representing hidden context for a traffic entity displayed in the image. The system executes the probabilistic neural network to generate output representing hidden context for traffic entities encountered while navigating through traffic. The system determines a measure of uncertainty for the output values. The autonomous vehicle uses the measure of uncertainty generated by the probabilistic neural network during navigation.
