순서,출원번호,출원일자,공개번호,공개일자,공고번호,공고일자,등록번호,등록일자,발명의명칭,IPC분류,출원인,요약
342,17696202,2022.03.16,20220297722,2022.09.22,20220297722,2022.09.22,,,"AUTONOMOUS DRIVING DEVICE, AUTONOMOUS DRIVING METHOD, AND PLURALITY OF NON-TRANSITORY STORAGE MEDIA","B60W60/00,B60W20/20,B60W20/13,G07C5/00",TOYOTA JIDOSHA KABUSHIKI KAISHA,"An autonomous driving device to be mounted on a vehicle includes a first ECU configured to autonomously drive the vehicle, and a second ECU configured to operate the vehicle under remote control from an outside. The first ECU is configured to keep an activated state while the second ECU is operating the vehicle. The second ECU is configured to keep a power saving state while the first ECU is autonomously driving the vehicle."
343,17664399,2022.05.20,20220283594,2022.09.08,20220283594,2022.09.08,,,AUTOMATED VEHICLE FOR AUTONOMOUS LAST-MILE DELIVERIES,"G05D1/02,G06Q10/08,B60R25/01,B60R25/24","DoorDash, Inc.,DoorDash, Inc.","Provided are various systems and processes for improving last-mile delivery of real-time, on-demand orders for perishable goods. In one aspect, an automated vehicle (AV) comprises a body including a storage compartment for storing perishable goods. The storage compartment is accessible by a user upon authentication of the user. The AV further comprises a sensor module for receiving data for navigating the AV. The sensor module is positioned above the body on a support structure at a predetermined height above the ground, such as three to five feet. The data includes one or more of the following: audio data, video data, radio waves, and backscattered light waves. The AV further comprises an onboard computer system configured to process the data to navigate the AV along motor vehicle routes and pedestrian routes. The AV may be configured to interface with an automated locker system to retrieve or deposit the perishable goods."
344,17193886,2021.03.05,20220281459,2022.09.08,20220281459,2022.09.08,,,AUTONOMOUS DRIVING COLLABORATIVE SENSING,"B60W40/04,G06T9/00,G06T7/70","Black Sesame International Holding Limited,Black Sesame International Holding Limited","A method of autonomous driving collaborative sensing, including receiving at least one sensor input, determining a pose based on the at least one sensor input, synchronizing the at least one sensor input to the pose, transforming the at least one sensor input, the pose and the synchronization, determining an intermediate representation based on the transform, determining an object extraction based on the transform, aggregating the at least one sensor input, the intermediate representation and the object extraction and determining a birds eye view of the aggregation."
345,17676825,2022.02.22,20220270165,2022.08.25,20220270165,2022.08.25,,,AUTONOMOUS VEHICLE MANAGEMENT DEVICE,"G06Q30/06,G06Q10/06",TOYOTA JIDOSHA KABUSHIKI KAISHA,"When a rental user schedule management unit (general user schedule management unit) receives, from a general user (rental user) different from the priority user that is a lease contractor, a general usage request for a predetermined autonomous vehicle in which a time zone excluding a priority usage time zone is specified, the rental user schedule management unit set the time zone specified by the general usage request as a general usage time zone."
346,17625538,2020.07.01,20220277246,2022.09.01,20220277246,2022.09.01,,,"Method for Coordinating an Autonomous Vehicle Fleet, and Vehicle Fleet Coordination System","G06Q10/06,G08G1/00,G05D1/02,G01C21/34,G06N3/02",Daimler AG,"A method for coordinating an autonomous vehicle fleet that includes a plurality of autonomous motor vehicles in a predetermined first region by a vehicle fleet coordination system. The method includes coordinating the autonomous vehicle fleet depending on a first regional environment profile of the predetermined first region, where a position in the predetermined first region dependent on the first regional environment profile is autonomously approached by a first autonomous motor vehicle of the plurality of autonomous motor vehicles. The method further includes generating the first regional environment profile on a basis of a second regional environment profile which is stored in an electronic computing device of the vehicle fleet coordination system and which is generated for a second region independent of the predetermined first region."
347,17686192,2022.03.03,20220286277,2022.09.08,20220286277,2022.09.08,,,"UNMANNED DRIVING INFORMATION STORAGE AND PLAYBACK METHOD, DEVICE AND STORAGE MEDIUM","H04L9/08,H04L9/32",Black Sesame Technologies Inc.,"The application relates to a method, a device and a storage medium for storing and playing back unmanned driving information, wherein the unmanned driving information storage method comprises the following steps of: acquiring a plurality of data signals associated with an abnormal event when the abnormal event of an unmanned vehicle is monitored; calculating a first hash value for each data signal; storing each first hash value and the corresponding data signal as a key value pair in a key value database respectively; generating a first Merkel tree based on each first hash value; and storing the first Merkel tree and critical data signals of the plurality of data signals into a blockchain, and generating corresponding electronic money addresses and transaction timestamps. By this method, the correctness, integrity, fairness, and credibility of abnormal field data can be guaranteed, and too much storage space will not be occupied at the same time."
348,17678039,2022.02.23,20220270490,2022.08.25,20220270490,2022.08.25,,,"AUTONOMOUS VEHICLE, AUTONOMOUS VEHICLE DISPATCH SYSTEM, AND MOBILE TERMINAL","G08G1/00,G01C21/36,G01C21/34,B60W60/00,H04W4/029,H04W4/40",TOYOTA JIDOSHA KABUSHIKI KAISHA,"A mobile terminal includes an input unit that is capable of receiving input of a dispatch request and a destination and a position determiner that is capable of obtaining a terminal position which is its own current position. In accordance with the dispatch request, an autonomous vehicle is designated as a vehicle that is to be dispatched. The autonomous vehicle includes an autonomous driving controller that performs driving control so as to track the mobile terminal based on the terminal position while on its way to pick up the user."
349,17629678,2019.09.02,20220242446,2022.08.04,20220242446,2022.08.04,,,AUTOMATIC DRIVING CONTROL DEVICE AND AUTOMATIC DRIVING CONTROL METHOD,"B60W60/00,G06V20/58,B60W50/14","Mitsubishi Electric Corporation,Mitsubishi Electric Corporation","Included are: an information acquisition unit for acquiring a plurality of pieces of vehicle surrounds information output from a plurality of respective sensors; a control amount inferring unit for inferring an automatic driving control amount on the basis of the plurality of pieces of vehicle surrounds information and a machine learning model, and outputting the automatic driving control amount; a monitoring unit for determining whether or not the reliability of any one of the plurality of pieces of vehicle surrounds information has decreased; and a control unit for controlling, when the monitoring unit determines that the reliability of any one of the plurality of pieces of vehicle surrounds information has decreased, the control amount inferring unit in such a way as to output the automatic driving control amount excluding an influence of the one of the plurality of pieces of vehicle surrounds information whose reliability is determined to be decreased."
350,16997981,2020.08.20,,,11414087,2022.08.16,11414087,2022.08.16,Method and system for providing personalized interactive assistance in an autonomous vehicle,"B60W40/08,G06N3/04,G06F9/451,B60W50/12",Wipro Limited,"Disclosed herein is method and interactive assistance system for providing personalized assistance to a driver or person in an autonomous vehicle. Parameters related to the user and the vehicle are monitored and compared with historical data to determine a deviation in the parameters. An abnormal condition is detected when the deviation is more than an optimal threshold. Further, a personalized interaction is initiated with the user through a selected one of the interactive assistance engine and one or more assistive activities are performed for handling the abnormal condition. In an embodiment, the method of present disclosure enhances both safety and user experience of the user of the autonomous vehicle."
351,17171390,2021.02.09,20220252409,2022.08.11,20220252409,2022.08.11,,,UPDATING A PICK-UP OR DROP-OFF LOCATION FOR A PASSENGER OF AN AUTONOMOUS VEHICLE,G01C21/34,GM Cruise Holdings LLC,"An autonomous vehicle (AV) described herein is configured to receive a pull over location specified by a passenger, and is further configured to refine the pull over location based upon one or more factors, where the factors include computer-readable content from a profile of the passenger, sensor data output by sensor systems of the AV, observed or predicted weather conditions, observed or predicted traffic, and/or observations recently generated by other AVs that belong to the same fleet as the AV."
352,17522256,2021.11.09,20220250644,2022.08.11,20220250644,2022.08.11,,,Trajectory Validation for Autonomous Driving,B60W60/00,Aptiv Technologies Limited,"A method of determining whether a planned trajectory of a first vehicle over a road along which the first vehicle and a second vehicle are traveling, is invalid, comprising: obtaining the planned trajectory, comprising a first state of the first vehicle for each of a plurality of time instants; obtaining a second state of the second vehicle for each time instant; determining, for each time instant, a respective lateral range extending from the second vehicle; and determining that the planned trajectory is invalid where, for the first and second states at one or more of the time instants: the first vehicle is within the lateral range and within a lane boundary region of the road; and a direction of a lateral velocity of the first vehicle is towards the second vehicle and a lateral acceleration of the first vehicle away from the second vehicle is smaller than a predetermined threshold."
353,16917118,2020.06.30,,,11409303,2022.08.09,11409303,2022.08.09,Image processing method for autonomous driving and apparatus thereof,"G05D1/02,H04N5/235,G06T5/00,G01C21/16,G01S19/47,G01C21/34,G01C21/26,H04N5/232,G06V10/25,G06V10/141,G06V20/56,G06V20/58,G06T7/73,G05D1/00,G06T5/50","SAMSUNG ELECTRONICS CO., LTD.",A processor implemented image processing method includes recognizing a target object in a first frame of an input image; adjusting an exposure of a second frame of the input image based on a brightness of the target object; and generating a synthesized image by synthesizing the first frame and the second frame.
354,17623794,2020.10.16,20220253748,2022.08.11,20220253748,2022.08.11,,,Techniques for Training Systems for Autonomous Vehicle Navigation,G06N20/00,Mobileye Vision Technologies Ltd.,"Techniques are disclosed for the implementation of machine learning model training utilities to generate models for advanced driving assistance system (ADAS), driving assistance, and/or automated vehicle (AV) systems. The techniques described herein may be implemented in conjunction with the utilization of open source and cloud-based machine learning training utilities to generate machine learning trained models. One example of such an open source solution includes TensorFlow, which is a free and open-source software library for dataflow and differentiable programming across a range of tasks. TensorFlow may be used in conjunction with many different types of machine learning utilities, such as Amazon's cloud-based SageMaker utility for instance, which is a fully-managed service that enables developers and data scientists to quickly and easily build, train, and deploy machine learning models at any scale."
355,16500308,2019.07.04,,,11414097,2022.08.16,11414097,2022.08.16,"Apparatus for generating position data, autonomous vehicle and method for generating position data","B60W60/00,G06T7/70,B60W40/08,B60W40/12,B60W50/10",LG Electronics Inc.,"Disclosed is an apparatus for generating position data including a processor which acquires position information of an antenna installed in a vehicle, generates position data of the vehicle based on the position information of the antenna, acquires information about change in an external appearance of the vehicle, and corrects the position data of the vehicle based on the information about the change in the external appearance of the vehicle."
356,16834459,2020.03.30,,,11415997,2022.08.16,11415997,2022.08.16,Autonomous driving simulations based on virtual simulation log data,"G05D1/02,G01C21/34","Zoox, Inc.","A driving simulation system may perform simulations using one or more of a virtual driving simulator or a log-based driving simulator. A log-based simulator may replay data from logs to test whether a control algorithm is successfully capable of navigating a scenario. However, when such log-based simulations are invalid (e.g., based on the results of the simulations or evaluations of conditions of the simulation), a virtual simulation may be generated for the vehicle control system during which new log data may be captured. Such a virtual simulation may comprise sensor simulations and more sophisticated object control for ensuring convergence to a scenario to be tested. The new log data may be used for additional log-based simulations, thereby improving the durability and flexibility for testing and/or validation, while reducing the computational overhead of driving simulation scenarios."
357,17400341,2021.08.12,20220063716,2022.03.03,20220063716,2022.03.03,,,APPARATUS AND METHOD FOR CONTROLLING STEERING OF AUTONOMOUS VEHICLE,"B62D6/00,B60W60/00,B62D15/02","HYUNDAI MOBIS CO., LTD,HYUNDAI MOBIS CO., LTD","Disclosed are apparatuses and methods for controlling the steering of an autonomous vehicle. The apparatus including an electric power steering device to generate an assist torque for a steering wheel, an autonomous driving position controller to control a steering position according to a command steering angle input from an autonomous driving module, a driver steering intervention judger to judge whether a driver intervenes in steering based on a column torque and a vehicle speed, a weight detector to detect a weight for integrating output of an electric power steering device and output of an autonomous driving position controller based on judging whether the driver intervenes in steering, and an output controller to apply the weight to the output of the electric power steering device and the output of the autonomous driving position controller to integrate the output of the electric power steering device and the output of the autonomous driving position controller, wherein the autonomous driving position controller is further configured to adjust a gain value for controlling the steering position by applying the weight."
358,17013996,2020.09.08,20220073097,2022.03.10,20220073097,2022.03.10,,,Methods and Systems for using Remote Assistance to Maneuver an Autonomous Vehicle to a Location,"B60W60/00,G05D1/00",Waymo LLC,"Example embodiments relate to using remote assistance to maneuver an autonomous vehicle to a location. A computing device used by a remote operator may receive a request for assistance from a vehicle that indicates the vehicle is stopped at a first location with one or more navigation options for enabling the vehicle to navigate from the first location to a second location. At least one navigation option includes a maneuver technique that requires operator approval prior to execution. The computing device may then display a graphical user interface (GUI) that conveys the one or more navigation options. Based on detecting a selection of a particular navigation option, the computing device may transmit instructions to the vehicle to perform the particular navigation option. The vehicle may configured to navigate from the first location to the second location by performing the particular navigation option while monitoring for changes in the environment."
359,17341788,2021.06.08,20220073055,2022.03.10,20220073055,2022.03.10,,,SYSTEM AND METHOD FOR CONTROLLING AUTONOMOUS PARKING OF VEHICLE,"B60W30/06,G06K9/00,G06K9/46,G06K9/62,G06K9/40","HYUNDAI MOTOR COMPANY,KIA CORPORATION,Hyundai Mobis Co., Ltd.","A system for performing autonomous parking of a vehicle includes: a camera configured to acquire a surrounding image of the vehicle including a parking line; and a controller configured to derive spatial recognition data based on the surrounding vehicle image as an input, derive a feature point corresponding to the parking line based on the surrounding image and the spatial recognition data, determine a candidate parking line based on clustering of the feature point, and control the vehicle to perform parking in a parking area having the candidate parking line."
360,16516068,2019.07.18,,,11390212,2022.07.19,11390212,2022.07.19,"Method and apparatus for unmanned vehicle passing through intersection, device and storage medium","B60Q5/00,G05D1/00,G05D1/02,B60R11/02,B60Q1/50","Baidu Online Network Technology (Beijing) Co., Ltd.","Embodiments of the present application provide a method and an apparatus for an unmanned vehicle passing through an intersection, a device and a storage medium. The method includes: detecting whether the unmanned vehicle is at an intersection without a traffic light sign; identifying a moving direction and a distance of outside personnel and/or identifying voice and limb reaction of the outside personnel when determining that the unmanned vehicle is at the intersection without the traffic light sign; determining whether to pass according to the moving direction and the distance of the outside personnel, and/or the voice and limb reaction of the outside personnel; and making a corresponding voice prompt and/or a corresponding visual prompt to the outside personnel according to a result of the determination on whether to pass."
361,16580076,2019.09.24,,,11348182,2022.05.31,11348182,2022.05.31,Autonomous vehicle operation feature monitoring and evaluation of effectiveness,"G06Q40/00,G06Q40/08,H04L67/12,H04W4/90,H04W4/44,G07C5/00,B60W40/09,G08G1/005,G08G1/16,G08G1/0967,G08G1/14,G08B21/06,B60W30/16,G08G1/00,G06K9/00,G08B25/08,G07C5/08,G06F30/20,G06Q10/06,B60Q9/00,G06Q20/08,B60R21/00,G05B15/02,H04W4/46,B60W40/08,G01S19/13,G06Q50/30",State Farm Mutual Automobile Insurance Company,"Methods and systems for monitoring use and determining risks associated with operation of a vehicle having one or more autonomous operation features are provided. According to certain aspects, a virtual log of data regarding performance of the features in a virtual test environment may be recorded during operation of the vehicle. This may include information regarding the vehicle, the vehicle environment, use of the autonomous operation features, and/or control decisions made by the features. The control decisions may include evasive maneuvers performed by the vehicle under the control of the features. The performance data in the virtual log may be used to determine risk levels associated with vehicle operation by the autonomous operation features. The risk levels may further be used to adjust an insurance policy associated with the vehicle."
362,16536231,2019.08.08,,,11249480,2022.02.15,11249480,2022.02.15,Autonomous vehicle positioning system,"G05D1/00,G08G1/01,G05D1/02,G08G1/09","TOYOTA MOTOR NORTH AMERICA, INC.","Systems and methods are provided to determine traffic configuration parameters, such as location and speed, that are correlated with optimal traffic flow specific to particular road regions. In a specific embodiment, the disclosure is directed to a vehicle positioning system which utilizes a multi-client server application model configured to perform predictive analysis based upon data collected from a plurality of data streams, infrastructure elements, and vehicles. In a particular implementation, roadways may be partitioned into road regions which may be associated with vehicle configuration templates. Vehicle configuration templates may define instructions for automated vehicle driving parameters within a particular road region. In a specific embodiment, the vehicle positioning system may invoke transition sequences based upon real-time traffic data to modify a given traffic configuration."
363,16380002,2019.04.10,,,11400925,2022.08.02,11400925,2022.08.02,Planning for unknown objects by an autonomous vehicle,"B60W30/09,G08G1/16,G06V10/26,G06V20/56,G06V20/58,B60W10/20,B60W10/184,G05D1/00,G05D1/02",Motional AD LLC,"Among other things, a model is maintained of an environment of a vehicle. A hypothetical object in the environment that cannot be perceived by sensors of the vehicle is included in the model."
364,16676563,2019.11.07,,,11238538,2022.02.01,11238538,2022.02.01,Accident risk model determination using autonomous vehicle operating data,"G06Q40/00,G06Q40/08,G08G1/16,G08G1/0967,G08G1/14,G08B21/06,B60W30/16,G08G1/00,G06K9/00,G08B25/08,G07C5/08,H04L29/08,H04W4/90,H04W4/44,G07C5/00,B60W40/09,G06Q10/06,B60Q9/00,G06Q20/08,B60R21/00,G05B15/02,G08G1/005,G06Q50/30,B60W40/08,H04W4/46,G01S19/13",State Farm Mutual Automobile Insurance Company,"Methods and systems for evaluating the effectiveness of autonomous operation features of autonomous vehicles using an accident risk model are provided. According to certain aspects, an accident risk model may be determined using effectiveness information regarding autonomous operation features associated with a vehicle. The effectiveness information may indicate a likelihood of an accident for the vehicle and may include test data or actual loss data. Determining the likelihood of an accident may include determining risk factors for the features related to the ability of the features to make control decisions that successfully avoid accidents. The accident risk model may further include information regarding effectiveness of the features relative to location or operating conditions, as well as types and severity of accidents. The accident risk model may further be used to determine or adjust aspects of an insurance policy associated with an autonomous vehicle."
365,16404208,2019.05.06,,,11235761,2022.02.01,11235761,2022.02.01,Operational risk assessment for autonomous vehicle control,"B60W30/095,B60W30/09,G05D1/00,G06K9/00","Retrospect Technology, LLC","Changes in the controlling of an autonomous vehicle are caused based on an operational risk determined for the autonomous vehicle. An operational risk monitor module of the autonomous vehicle uses information about objects detected within an environment in which the autonomous vehicle is located and predicted behaviors of those objects to assess the operational risk of the autonomous vehicle along a planned path. The operational risk is used to determine whether to cause a change in the controlling of the autonomous vehicle, for example, based on a comparison between the operational risk and a previously estimated operational risk or based on a determination that the operational risk exceeds a threshold. The operational risk monitor module transmits a signal to one or more control system modules of the autonomous vehicle to indicate to change the controlling of the autonomous vehicle based on the operational risk."
366,17649330,2022.01.28,20220234622,2022.07.28,20220234622,2022.07.28,,,Systems and Methods for Autonomous Vehicle Control,"B60W60/00,B60W30/095,G06K9/62","dRISK, Inc.,dRISK, Inc.","Systems and methods for training AV models in accordance with embodiments of the invention are illustrated. One embodiment includes an autonomous vehicle (AV), a vehicle, a processor, and a memory, where the memory contains an AV model capable of driving the vehicle without human input, where the AV model is trained on a plurality of edge case scenarios. In a still further additional embodiment, a method for training AV models, including obtaining a data structure storing a plurality of scenarios that an AV can encounter, and distance metrics indicating the distance between each scenario, generating a list of edge case scenarios within the plurality of scenarios, identifying hazard frames within the edge case scenarios, encoding the hazard frames into one or more records interpretable by an AV model, and training the AV model using the one or more records."
367,16809540,2020.03.04,,,11386674,2022.07.12,11386674,2022.07.12,Class labeling system for autonomous driving,"G06V20/56,G06K9/62,G06T7/12,G06V10/44,G06V10/22,G06V10/24,G06V20/58","HYUNDAI MOBIS Co., Ltd.","A class labeling system for autonomous driving includes a detection module, a segmentation module, and a lane road boundary detection module. The detection module is configured to detect objects for autonomous driving from an image captured by a camera to generate a bounding box for each of the objects and detect property information about the object. The segmentation module is configured to determine classes for each pixel of the bounding box detected by the detection module and process at least one of the classes as don't care. The lane road boundary detection module is configured to detect at least one of lane and road boundaries using the bounding box detected by the detection module."
