순서,출원번호,출원일자,공개번호,공개일자,공고번호,공고일자,등록번호,등록일자,발명의명칭,IPC분류,출원인,요약
174,17377761,2021.07.16,20220324477,2022.10.13,20220324477,2022.10.13,,,METHOD AND SYSTEM FOR RECOGNIZING ACTIVITIES IN SURROUNDING ENVIRONMENT FOR CONTROLLING NAVIGATION OF AUTONOMOUS VEHICLE,"B60W60/00,G06K9/00,G06T7/246,G06N3/04","Wipro Limited,Indian Institute of Science","A method and activity recognition system for recognising activities in surrounding environment for controlling navigation of an autonomous vehicle is disclosed. The activity recognition system receives first data feed from neuromorphic event-based camera and second data feed from frame-based RGB video camera. The first data feed comprises high-speed temporal information encoding motion associated with change in surrounding environment at each spatial location, and second data feed comprises spatio-temporal data providing scene-level contextual information associated with surrounding environment. An adaptive sampling of second data feed is performed with respect to foreground activity rate based on amount of foreground motion encoded in first data feed. Further, the activity recognition system recognizes activities associated with at least one object in surrounding environment by identifying correlation between both data feed by using two-stream neural network model. Thereafter, based on the determined activities, the activity recognition system controls the navigation of the autonomous vehicle."
175,16917440,2020.06.30,,,11377125,2022.07.05,11377125,2022.07.05,Vehicle rideshare localization and passenger identification for autonomous vehicles,"B60W60/00,B60W40/08,G01S19/42,G01C21/34,G08G1/123,H04N7/18,H04W4/024,G01S19/40","Rivian IP Holdings, LLC","Various disclosed embodiments include methods of locating an intended passenger of an automotive vehicle and vehicle-based systems for locating an intended passenger of an automotive vehicle. In an illustrative embodiment, a method of locating an intended passenger of an automotive vehicle includes: moving an automotive vehicle to an approximate location of an intended passenger based on a location signal from the intended passenger received via a wireless network; after moving to the approximate location of the intended passenger, receiving, by the vehicle, an image from an electronic device of the intended passenger, the image being an image of the intended passenger or an image of local physical surroundings of the intended passenger; processing the image to determine additional location information of the intended passenger based on matching the image against one or more reference images; and accepting by the vehicle, the intended passenger responsive to the image processing."
176,17518400,2021.11.03,20220153303,2022.05.19,20220153303,2022.05.19,,,Methods and Systems for Determining a Maneuver to be Executed by an Autonomous Vehicle,"B60W60/00,B60W30/095,G06F9/30,G06N3/063",Aptiv Technologies Limited,A computer implemented method for determining a maneuver to be executed by an autonomous vehicle comprises the following steps carried out by computer hardware components: determining a plurality of potential maneuvers; determining a subset of the potential maneuvers based on a pre-determined condition; determining a mask based on the subset; determining an output of a fully connected layer of a neural network; determining a dot product of the output of the fully connected layer and the mask; and determining the maneuver to be executed based on the dot product.
177,16917440,2020.06.30,20210403055,2021.12.30,20210403055,2021.12.30,,,VEHICLE RIDESHARE LOCALIZATION AND PASSENGER IDENTIFICATION FOR AUTONOMOUS VEHICLES,"B60W60/00,B60W40/08,G01S19/42,G01C21/34,G01S19/40,G08G1/123,H04N7/18,H04W4/024","Rivian IP Holdings, LLC","Various disclosed embodiments include methods of locating an intended passenger of an automotive vehicle and vehicle-based systems for locating an intended passenger of an automotive vehicle. In an illustrative embodiment, a method of locating an intended passenger of an automotive vehicle includes: moving an automotive vehicle to an approximate location of an intended passenger based on a location signal from the intended passenger received via a wireless network; after moving to the approximate location of the intended passenger, receiving, by the vehicle, an image from an electronic device of the intended passenger, the image being an image of the intended passenger or an image of local physical surroundings of the intended passenger; processing the image to determine additional location information of the intended passenger based on matching the image against one or more reference images; and accepting by the vehicle, the intended passenger responsive to the image processing."
178,17463175,2021.08.31,20210397184,2021.12.23,20210397184,2021.12.23,,,AUTONOMOUS VEHICLE ROUTING BASED UPON RISK OF AUTONOMOUS VEHICLE TAKEOVER,"G05D1/00,G05D1/02,G01C21/34,G01C21/20",GM Cruise Holdings LLC,"Various technologies described herein pertain to routing an autonomous vehicle based upon risk of takeover of the autonomous vehicle by a human operator. A computing system receives an origin location and a destination location of the autonomous vehicle. The computing system identifies a route for the autonomous vehicle to follow from the origin location to the destination location based upon output of a computer-implemented model. The computer-implemented model is generated based upon labeled data indicative of instances in which autonomous vehicles are observed to transition from operating autonomously to operating based upon conduction by human operators while the autonomous vehicles are executing predefined maneuvers. The computer-implemented model takes, as input, an indication of a maneuver in the predefined maneuvers that is performed by the autonomous vehicle when the autonomous vehicle follows a candidate route. The autonomous vehicle then follows the route from the origin location to the destination location."
179,16280599,2019.02.20,,,11112794,2021.09.07,11112794,2021.09.07,Autonomous vehicle routing based upon risk of autonomous vehicle takeover,"G05D1/00,G05D1/02,G01C21/34,G01C21/20",GM Cruise Holdings LLC,"Various technologies described herein pertain to routing an autonomous vehicle based upon risk of takeover of the autonomous vehicle by a human operator. A computing system receives an origin location and a destination location of the autonomous vehicle. The computing system identifies a route for the autonomous vehicle to follow from the origin location to the destination location based upon output of a computer-implemented model. The computer-implemented model is generated based upon labeled data indicative of instances in which autonomous vehicles are observed to transition from operating autonomously to operating based upon conduction by human operators while the autonomous vehicles are executing predefined maneuvers. The computer-implemented model takes, as input, an indication of a maneuver in the predefined maneuvers that is performed by the autonomous vehicle when the autonomous vehicle follows a candidate route. The autonomous vehicle then follows the route from the origin location to the destination location."
180,16853151,2020.04.20,20210004012,2021.01.07,20210004012,2021.01.07,,,Goal-Directed Occupancy Prediction for Autonomous Driving,"G05D1/02,G01C21/34,G05D1/00,B60W60/00","UATC, LLC","An autonomous vehicle can obtain state data associated with an object in an environment, obtain map data including information associated with spatial relationships between at least a subset of lanes of a road network, and determine a set of candidate paths that the object may follow in the environment based at least in part on the spatial relationships between at least two lanes of the road network. Each candidate path can include a respective set of spatial cells. The autonomous vehicle can determine, for each candidate path, a predicted occupancy for each spatial cell of the respective set of spatial cells of such candidate path during at least a portion of a prediction time horizon. The autonomous vehicle can generate prediction data associated with the object based at least in part on the predicted occupancy for each spatial cell of the respective set of spatial cells for at least one candidate path."
181,16431842,2019.06.05,20200387161,2020.12.10,20200387161,2020.12.10,,,SYSTEMS AND METHODS FOR TRAINING AN AUTONOMOUS VEHICLE,"G05D1/02,G06N3/08,G06K9/62","GM GLOBAL TECHNOLOGY OPERATIONS LLC,GM GLOBAL TECHNOLOGY OPERATIONS LLC","Systems and method are provided for training an autonomous vehicle. In various embodiments, a method includes: storing, in a data storage device, real world data including a sequence of images of a road environment, the sequence of images generated based on a vehicle traversing the road environment; processing, in an offline simulation environment, the sequence of images with a deep reinforcement learning agent associated with a control feature of the autonomous vehicle to obtain an optimized set of control policies; and training the autonomous vehicle based on the optimized set of control polices."
182,16280415,2019.02.20,20200264619,2020.08.20,20200264619,2020.08.20,,,AUTONOMOUS VEHICLE ROUTING BASED UPON SPATIOTEMPORAL FACTORS,"G05D1/02,G01C21/20,G01C21/34,G05D1/00,G01C21/36",GM Cruise Holdings LLC,"Various technologies described herein pertain to routing autonomous vehicles based upon spatiotemporal factors. A computing system receives an origin location and a destination location of an autonomous vehicle. The computing system identifies a route for the autonomous vehicle to follow from the origin location to the destination location based upon output of a spatiotemporal statistical model. The spatiotemporal statistical model is generated based upon historical data from autonomous vehicles when the autonomous vehicles undergo operation-influencing events. The spatiotemporal statistical model takes, as input, a location, a time, and a direction of travel of the autonomous vehicle. The spatiotemporal statistical model outputs a score that is indicative of a likelihood that the autonomous vehicle will undergo an operation-influencing event due to the autonomous vehicle encountering a spatiotemporal factor along a candidate route. The autonomous vehicle then follows the route from the origin location to the destination location."
183,16280599,2019.02.20,20200264605,2020.08.20,20200264605,2020.08.20,,,AUTONOMOUS VEHICLE ROUTING BASED UPON RISK OF AUTONOMOUS VEHICLE TAKEOVER,"G05D1/00,G05D1/02,G01C21/20,G01C21/34",GM Cruise Holdings LLC,"Various technologies described herein pertain to routing an autonomous vehicle based upon risk of takeover of the autonomous vehicle by a human operator. A computing system receives an origin location and a destination location of the autonomous vehicle. The computing system identifies a route for the autonomous vehicle to follow from the origin location to the destination location based upon output of a computer-implemented model. The computer-implemented model is generated based upon labeled data indicative of instances in which autonomous vehicles are observed to transition from operating autonomously to operating based upon conduction by human operators while the autonomous vehicles are executing predefined maneuvers. The computer-implemented model takes, as input, an indication of a maneuver in the predefined maneuvers that is performed by the autonomous vehicle when the autonomous vehicle follows a candidate route. The autonomous vehicle then follows the route from the origin location to the destination location."
184,16724424,2019.12.23,20200250853,2020.08.06,20200250853,2020.08.06,,,METHOD AND DEVICE FOR SUPPORTING ADMINISTRATORS TO EVALUATE OBJECT DETECTING PROCESSES OF OBJECT DETECTORS TO PROVIDE LOGICAL GROUNDS OF AUTONOMOUS DRIVING,"G06T7/73,G06K9/62,G06N3/04,G06N3/08","StradVision, Inc.","A method for supporting at least one administrator to evaluate detecting processes of object detectors to provide logical grounds of an autonomous driving is provided. And the method includes steps of: (a) a computing device instructing convolutional layers, included in an object detecting CNN which has been trained before, to generate reference convolutional feature maps by applying convolutional operations to reference images inputted thereto, and instructing ROI pooling layers included therein to generate reference ROI-Pooled feature maps by pooling at least part of values corresponding to ROIs on the reference convolutional feature maps; and (b) the computing device instructing a representative selection unit to classify the reference ROI-Pooled feature maps by referring to information on classes of objects included in their corresponding ROIs on the reference images, and to generate at least one representative feature map per each class."
185,17359425,2021.06.25,,,11237558,2022.02.01,11237558,2022.02.01,Online machine learning for autonomous earth moving vehicle control,"E01C19/00,E01C21/00,E01C23/00,E02F3/00,E02F5/00,E21C49/02,G05D1/00,G06N20/00,G05D1/02",Built Robotics Inc.,"An autonomous earth moving system can determine a desired state for a portion of the EMV including at least one control surface. Then the EMV selects a set of control signals for moving the portion of the EMV from the current state to the desired state using a machine learning model trained to generate control signals for moving the portion of the EMV to the desired state based on the current state. After the EMV executes the selected set of control signals, the system measures an updated state of the portion of the EMV. In some cases, this updated state of the EMV is used to iteratively update the machine learning model using an online learning process."
186,16410822,2019.05.13,,,11144054,2021.10.12,11144054,2021.10.12,Safety controls for network connected autonomous vehicle,"G05D1/00,G05D1/02,B60W30/18",THE BOEING COMPANY,Method and apparatus for ensuring safety controls for a network-connected autonomous vehicle. The method and apparatus monitor a respective state of each of one or more data communication connections one or more data communication networks. One of a plurality of operational modes for the autonomous vehicle is selected based on the monitored states. Each of the plurality of operational modes defines a respective level of autonomous control for the autonomous vehicle. The method and apparatus transition operation of the autonomous vehicle to the selected operational mode.
187,16410822,2019.05.13,20200142402,2020.05.07,20200142402,2020.05.07,,,SAFETY CONTROLS FOR NETWORK CONNECTED AUTONOMOUS VEHICLE,"G05D1/00,G05D1/02",THE BOEING COMPANY,Method and apparatus for ensuring safety controls for a network-connected autonomous vehicle. The method and apparatus monitor a respective state of each of one or more data communication connections one or more data communication networks. One of a plurality of operational modes for the autonomous vehicle is selected based on the monitored states. Each of the plurality of operational modes defines a respective level of autonomous control for the autonomous vehicle. The method and apparatus transition operation of the autonomous vehicle to the selected operational mode.
188,16521288,2019.07.24,20200031361,2020.01.30,20200031361,2020.01.30,,,Autonomous Efficient Driving Strategy Using Behavior-Based Learning,"B60W50/00,G05B13/02,G05D1/00,B60W30/18,B60W10/04,B60W40/09","Continental Powertrain USA, LLC,Continental Powertrain USA, LLC","A method of modifying one or more parameters of a propulsion system of a vehicle in real time during an autonomous driving mode of the vehicle is provided. The method includes receiving a destination by way of a user interface in communication with the data processing hardware and determining a path from a current vehicle location to the destination. The method includes transmitting to a drive system of the vehicle, driving instructions causing the vehicle to autonomously follow the path. The method includes receiving sensor data from a vehicle sensor system and determining a propulsion adjustment based on an ideal driver behavior and the sensor data. The method also includes transmitting to the propulsion system, propulsion instructions to modify the one or more parameters of the propulsion system to improve vehicle efficiency and/or performance."
189,17855253,2022.06.30,20220332348,2022.10.20,20220332348,2022.10.20,,,"AUTONOMOUS DRIVING METHOD, RELATED DEVICE, AND COMPUTER-READABLE STORAGE MEDIUM","B60W60/00,B60W40/04,B60W50/00,H04W4/44,G06N3/04","HUAWEI TECHNOLOGIES CO., LTD.",The present disclosure provides example autonomous driving apparatuses and computer program products. One example apparatus includes receiving vehicle attribute information and traveling information of a target vehicle from the target vehicle. Layer information of a first road section on which the target vehicle travels is obtained from an autonomous-driving-policy-layer based on the traveling information. A first autonomous driving policy for the target vehicle is obtained based on the layer information of the first road section and the vehicle attribute information of the target vehicle. The first driving policy is sent to the target vehicle.
190,17716697,2022.04.08,20220236729,2022.07.28,20220236729,2022.07.28,,,SELF-MAINTAINING AUTONOMOUS VEHICLE PROCEDURE,"G05B23/02,B60W50/029,B60W50/02,B60W60/00,G06Q10/00",GM Cruise Holdings LLC,"Aspects of the disclosed technology encompass solutions for automatically managing autonomous vehicle (AV) operating and maintenance tasks, such as implementing an alternative operating mode or ordering replacement parts for an AV components. In some aspects, a process of the disclosed technology can include steps for receiving diagnostic data corresponding with an AV component, determining an estimated life cycle of the AV component, and determining whether to generate an action to implement an alternative operating mode or an order request for one or more replacement parts of the AV component, based on the estimated life cycle of the AV component. Systems and machine-readable media are also provided."
191,16420686,2019.05.23,,,11370423,2022.06.28,11370423,2022.06.28,Multi-task machine-learned models for object intention determination in autonomous driving,"B60W30/095,G05D1/02,G06N20/00,G06V20/58","UATC, LLC","Generally, the disclosed systems and methods utilize multi-task machine-learned models for object intention determination in autonomous driving applications. For example, a computing system can receive sensor data obtained relative to an autonomous vehicle and map data associated with a surrounding geographic environment of the autonomous vehicle. The sensor data and map data can be provided as input to a machine-learned intent model. The computing system can receive a jointly determined prediction from the machine-learned intent model for multiple outputs including at least one detection output indicative of one or more objects detected within the surrounding environment of the autonomous vehicle, a first corresponding forecasting output descriptive of a trajectory indicative of an expected path of the one or more objects towards a goal location, and/or a second corresponding forecasting output descriptive of a discrete behavior intention determined from a predefined group of possible behavior intentions."
192,17450914,2021.10.14,20220107651,2022.04.07,20220107651,2022.04.07,,,PREDICTING THREE-DIMENSIONAL FEATURES FOR AUTONOMOUS DRIVING,"G05D1/02,G06N20/00,G06K9/00,G06K9/62,G06T7/20","Tesla, Inc.",A processor coupled to memory is configured to receive image data based on an image captured by a camera of a vehicle. The image data is used as a basis of an input to a trained machine learning model trained to predict a three-dimensional trajectory of a machine learning feature. The three-dimensional trajectory of the machine learning feature is provided for automatically controlling the vehicle.
193,17000128,2020.08.21,20220055663,2022.02.24,20220055663,2022.02.24,,,METHOD AND SYSTEM FOR BEHAVIORAL CLONING OF AUTONOMOUS DRIVING POLICIES FOR SAFE AUTONOMOUS AGENTS,"B60W60/00,B60W30/18,G06K9/00,G06N3/08,B60W10/20","TOYOTA RESEARCH INSTITUTE, INC,,TOYOTA RESEARCH INSTITUTE, INC.","A method for behavior cloned vehicle trajectory planning is described. The method includes perceiving vehicles proximate an ego vehicle in a driving environment, including a scalar confidence value of each perceived vehicle. The method also includes generating a bird's-eye-view (BEV) grid showing the ego vehicle and each perceived vehicle based on each of the scalar confidence value. The method further includes ignoring at least one of the perceived vehicles when the scalar confidence value of the at least one of the perceived vehicles is less than a predetermined value. The method also includes selecting an ego vehicle trajectory based on a cloned expert vehicle behavior policy according to remaining perceived vehicles."
194,16265720,2019.02.01,,,11150664,2021.10.19,11150664,2021.10.19,Predicting three-dimensional features for autonomous driving,"G05D1/02,G06N20/00,G06K9/00,G06K9/62,G06T7/20","Tesla, Inc.",A processor coupled to memory is configured to receive image data based on an image captured by a camera of a vehicle. The image data is used as a basis of an input to a trained machine learning model trained to predict a three-dimensional trajectory of a machine learning feature. The three-dimensional trajectory of the machine learning feature is provided for automatically controlling the vehicle.
195,17216351,2021.03.29,20210216790,2021.07.15,20210216790,2021.07.15,,,DETERMINING AUTONOMOUS VEHICLE STATUS BASED ON MAPPING OF CROWDSOURCED OBJECT DATA,"G06K9/00,G01C21/30,G06N3/02,G05D1/00,G06N20/00,G06F16/29,G01C21/36","Micron Technology, Inc.","A map in a cloud service stores physical objects previously detected by other vehicles that have previously traveled over the same road that a current vehicle is presently traveling on. New data received by the cloud service from the current vehicle regarding new objects that are being encountered by the current vehicle can be compared to the previous object data stored in the map. Based on this comparison, an operating status of the current vehicle is determined. In response to determining the status, an action such as terminating an autonomous navigation mode of the current vehicle is performed."
196,16817068,2020.03.12,20210188316,2021.06.24,20210188316,2021.06.24,,,Systems and Methods for Generating Behavioral Predictions in Reaction to Autonomous Vehicle Movement,"B60W60/00,G06N20/00,G06N3/08","UATC, LLC","Systems and methods are directed to generating behavioral predictions in reaction to autonomous vehicle movement. In one example, a computer-implemented method includes obtaining, by a computing system, local scene data associated with an environment external to an autonomous vehicle, the local scene data including actor data for an actor in the environment external to the autonomous vehicle. The method includes extracting, by the computing system and from the local scene data, one or more actor prediction parameters for the actor using a machine-learned parameter extraction model. The method includes determining, by the computing system, a candidate motion plan for the autonomous vehicle. The method includes generating, by the computing system and using a machine-learned prediction model, a reactive prediction for the actor based at least in part on the one or more actor prediction parameters and the candidate motion plan."
197,16567877,2019.09.11,20200007767,2020.01.02,10855922,2020.12.01,10855922,2020.12.01,Inner monitoring system of autonomous vehicle and system thereof,"H04N7/18,H04N5/232,G06K9/00,G06K9/46",LG Electronics Inc.,"A method of monitoring an interior of an autonomous vehicle using an image sensor including a unit pixel composed of an infrared pixel and three primary color-pixels, according to an embodiment of the present invention, includes the following procedure. Setting an RGB mode boundary value that is expressed in illumination and an infrared mode boundary value having illumination lower than the RGB mode boundary value; acquiring an illumination value of the interior of the vehicle; and creating an RGB image and an infrared image from the image sensor in accordance with the illumination value and driving in a common mode that creates both of the RGB image and the infrared image when the illumination value is less than the RGB mode boundary value and is the infrared mode boundary value or more."
198,16265720,2019.02.01,20200249685,2020.08.06,20200249685,2020.08.06,,,PREDICTING THREE-DIMENSIONAL FEATURES FOR AUTONOMOUS DRIVING,"G05D1/02,G06K9/00,G06T7/20,G06K9/62,G06N20/00","Tesla, Inc.",A processor coupled to memory is configured to receive image data based on an image captured by a camera of a vehicle. The image data is used as a basis of an input to a trained machine learning model trained to predict a three-dimensional trajectory of a machine learning feature. The three-dimensional trajectory of the machine learning feature is provided for automatically controlling the vehicle.
